{
  "protocol": "MAP",
  "version": "0.1",
  "map_id": "map_eu_2026_000001",
  "mrp_ref": "mrp_eu_2026_000001",
  "accf_ref": "accf_eu_prod_000001",

  "audit_scope": {
    "standard_refs": [
      {
        "namespace": "ISO",
        "id": "ISO/IEC 42001",
        "clause": "AIMS governance controls"
      },
      {
        "namespace": "EU",
        "id": "AI Act",
        "clause": "risk management + logging obligations"
      },
      {
        "namespace": "EU",
        "id": "DORA",
        "clause": "ICT risk management + incident linkage"
      }
    ],
    "time_window": {
      "from": "2026-02-01T00:00:00Z",
      "to": "2026-03-01T00:00:00Z"
    },
    "environment": "prod"
  },

  "evidence": {
    "documents": [
      {
        "name": "System Description",
        "uri": "repo://docs/architecture.md",
        "hash": "sha256:1111111111111111111111111111111111111111111111111111111111111111"
      },
      {
        "name": "Risk Assessment",
        "uri": "repo://docs/regulatory-mapping.md",
        "hash": "sha256:2222222222222222222222222222222222222222222222222222222222222222"
      },
      {
        "name": "ACCF Policy Bundle",
        "uri": "repo://schemas/accf/accf.v0.1.schema.json",
        "hash": "sha256:3333333333333333333333333333333333333333333333333333333333333333"
      }
    ],
    "telemetry_refs": [
      {
        "provider": "otel",
        "ref": "otel://registack-prod-accf-events?from=2026-02-01T00:00:00Z&to=2026-03-01T00:00:00Z",
        "integrity_hash": "sha256:4444444444444444444444444444444444444444444444444444444444444444"
      },
      {
        "provider": "siem",
        "ref": "siem://query/registack-prod?window=2026-02-01..2026-03-01&tag=accf_enforcement",
        "integrity_hash": "sha256:5555555555555555555555555555555555555555555555555555555555555555"
      }
    ],
    "controls": [
      {
        "control_id": "MAP-LOG-001",
        "description": "All policy enforcement actions are logged with immutable telemetry references.",
        "implementation_ref": "accf.telemetry.event_stream + hash_chain",
        "status": "implemented"
      },
      {
        "control_id": "MAP-HITL-001",
        "description": "High-severity violations invoke human-in-the-loop escalation workflow.",
        "implementation_ref": "accf.constraints[].enforcement.human_in_the_loop",
        "status": "implemented"
      },
      {
        "control_id": "MAP-ID-001",
        "description": "All audited systems are traceable to an MRP registration identifier.",
        "implementation_ref": "mrp_ref linkage",
        "status": "implemented"
      }
    ]
  },

  "findings": [
    {
      "finding_id": "f_telemetry_001",
      "severity": "medium",
      "statement": "Telemetry retention is configured, but evidence of periodic retention verification is not yet included in the audit packet.",
      "related_refs": [
        "otel://registack-prod-accf-events",
        "accf.telemetry.retention.days"
      ],
      "remediation": {
        "owner": "platform-security",
        "due_date": "2026-04-01",
        "plan": "Add a scheduled retention verification report and attach its immutable hash reference as audit evidence."
      }
    }
  ],

  "cab_hitl": {
    "cab_required": true,
    "cab_decision": "approved_with_conditions",
    "cab_evidence_seal": "sha256:6666666666666666666666666666666666666666666666666666666666666666",
    "reviewers": [
      "cab_reviewer_01",
      "cab_reviewer_02"
    ]
  },

  "signatures": [
    {
      "signed_by": "Registack Infrastructure GmbH",
      "method": "x509",
      "signature": "BASE64_SIGNATURE_PLACEHOLDER",
      "signed_at": "2026-03-01T10:10:00Z"
    }
  ],

  "created_at": "2026-03-01T10:05:00Z"
}
